{
  "scan_id": "scan_20250928_1714",
  "started_at": "2025-09-28T17:02:00+02:00",
  "ended_at": "2025-09-28T17:14:00+02:00",
  "config": "freep-ict-daily-v3",
  "routes": [
    { "url": "https://careers.accenture.com/fr-fr/", "pages_visited": 12, "result": "success", "error": null },
    { "url": "https://www.capgemini.com/fr-fr/carrieres", "pages_visited": 8, "result": "success", "error": null },
    { "url": "https://www.thalesgroup.com/fr/emplois", "pages_visited": 5, "result": "partial", "error": "Timeout on page 5" },
    { "url": "https://jobs.bnpparibas.com/fr/", "pages_visited": 10, "result": "success", "error": null },
    { "url": "https://www.orange.jobs/fr/", "pages_visited": 7, "result": "failed", "error": "403 Forbidden" },
    { "url": "https://www.soprasteria.com/fr/carrieres", "pages_visited": 9, "result": "success", "error": null }
  ],
  "convergence_rounds": [
    { "round": 1, "new_routes_discovered": 3, "converged": false, "observed_at": "2025-09-28T17:06:00+02:00" },
    { "round": 2, "new_routes_discovered": 0, "converged": true, "observed_at": "2025-09-28T17:12:00+02:00" }
  ],
  "counts": {
    "discovered": 13,
    "processed": 13,
    "duplicates": 0,
    "new": 6,
    "changed": 4,
    "closed": 2,
    "temporarily_not_found": 1,
    "errors": 1
  },
  "dedup_rule": "canonical_url + content_hash",
  "scan_status": "COMPLETE_WITHIN_SCAN_WINDOW",
  "published": { "value": true, "reason": null },
  "errors": [
    { "reference": "job-1243", "reason": "HTTP 500 - Internal Server Error", "retry_count": 2, "recovery_status": "recovered" },
    { "reference": "https://www.orange.jobs/fr/", "reason": "403 Forbidden", "retry_count": 1, "recovery_status": "unresolved" }
  ]
}
