{
  "scan_id": "scan_20250921_0930",
  "started_at": "2025-09-21T09:30:00+02:00",
  "ended_at": "2025-09-21T09:47:00+02:00",
  "config": "freep-ict-daily-v3",
  "routes": [
    { "url": "https://careers.accenture.com/fr-fr/", "pages_visited": 12, "result": "success", "error": null },
    { "url": "https://www.capgemini.com/fr-fr/carrieres", "pages_visited": 3, "result": "failed", "error": "Connection timed out" },
    { "url": "https://www.thalesgroup.com/fr/emplois", "pages_visited": 0, "result": "failed", "error": "Route unreachable" },
    { "url": "https://jobs.bnpparibas.com/fr/", "pages_visited": 10, "result": "success", "error": null }
  ],
  "convergence_rounds": [
    { "round": 1, "new_routes_discovered": 2, "converged": false, "observed_at": "2025-09-21T09:38:00+02:00" }
  ],
  "counts": {
    "discovered": 9,
    "processed": 6,
    "duplicates": 0,
    "new": 2,
    "changed": 1,
    "closed": 0,
    "temporarily_not_found": 0,
    "errors": 3
  },
  "dedup_rule": "canonical_url + content_hash",
  "scan_status": "INCOMPLETE",
  "published": { "value": false, "reason": "Scan window closed before all known routes converged" },
  "errors": [
    { "reference": "https://www.capgemini.com/fr-fr/carrieres", "reason": "Connection timed out", "retry_count": 3, "recovery_status": "unresolved" },
    { "reference": "https://www.thalesgroup.com/fr/emplois", "reason": "Route unreachable", "retry_count": 3, "recovery_status": "unresolved" },
    { "reference": "job-1256", "reason": "Document parsing failed", "retry_count": 1, "recovery_status": "unresolved" }
  ]
}
